{
  "schemaVersion": "1.0",
  "kind": "EvidenceRecord",
  "id": "EV-MERIDIAN-0091",
  "workOrderId": "WO-MERIDIAN-0042",
  "candidateDigest": "sha256:8e63b0d22d72fb515299fb5bdceaf07b4f1b334d59e84c9f7e8ab14b364e52da",
  "criterionId": "explanation-fidelity",
  "producerId": "factory-producer-01",
  "evaluator": {
    "actorId": "contract-evaluator-02",
    "type": "deterministic",
    "independence": "separate-method"
  },
  "method": "Versioned conflict-explanation contract suite",
  "result": "pass",
  "decisive": true,
  "observedAt": "2026-08-22T18:00:00Z",
  "limitations": ["Synthetic and approved de-identified cases only"]
}
